,number,value,datetime_start,datetime_complete,duration,params_alpha,params_beta1,params_beta2,params_bidirectional,params_dropout,params_embed_dim,params_hidden_size,params_lr,params_momentum,params_num_layers,params_optimizer,params_weight_decay,state
94,94,0.0016013428233867914,2026-04-12 19:30:00.589717,2026-04-12 19:30:05.108621,0 days 00:00:04.518904,,0.8004480716902027,0.9689301323912523,True,0.3989330885047557,128,64,0.002121438485384509,,1,Adam,1.8791671594601936e-05,COMPLETE
95,95,0.0034644857808931993,2026-04-12 19:30:05.118937,2026-04-12 19:30:08.651430,0 days 00:00:03.532493,,0.8001050036807005,0.9690461009205068,True,0.3643553421632343,128,64,0.0012322347691736111,,1,Adam,1.118659120124725e-05,PRUNED
96,96,0.005440788564819567,2026-04-12 19:30:08.660556,2026-04-12 19:30:13.284360,0 days 00:00:04.623804,,0.8320292373998179,0.9731497404759989,True,0.3244941837003425,128,128,0.0038272112668876947,,1,Adam,1.754325129927648e-05,PRUNED
97,97,0.011017294136427675,2026-04-12 19:30:13.296354,2026-04-12 19:30:15.638948,0 days 00:00:02.342594,,0.8065966448061295,0.9670787556660513,True,0.35276283766715005,128,64,0.00047180945442533645,,1,Adam,0.0001348040869742687,PRUNED
98,98,0.0047007371709685015,2026-04-12 19:30:15.648314,2026-04-12 19:30:18.985328,0 days 00:00:03.337014,,0.7842211903156525,0.9831940155594104,True,0.15934732363507328,128,64,0.0019728554716053693,,2,Adam,1.3422374327076871e-05,PRUNED
99,99,0.013239936781513273,2026-04-12 19:30:18.994164,2026-04-12 19:30:21.485914,0 days 00:00:02.491750,0.8645095870866542,,,False,0.3998148302019052,64,64,0.007688507021608636,,1,RMSprop,1.576267776188338e-05,PRUNED
